{
  "schema_version": "1.0",
  "workflow_id": "task:review-runtime-contract",
  "participant_id": "agent:volva:anthropic:operator",
  "runtime_session_id": "exec:3fa85f64-5717-4562-b3fc-2c963f66afa6",
  "project_root": "/workspace/basidiocarp",
  "worktree_id": "main",
  "host_ref": "volva:anthropic",
  "backend_ref": "anthropic-api"
}
